article_title,filename,link1_title,link1_filename,link2_title,link2_filename,link3_title,link3_filename,link4_title,link4_filename
What Type of Grass Do I Have,what-type-of-grass-do-i-have.html,Why Grass Dies in Summer,why-grass-dies-in-summer.html,Can Grass Grow on Clay Soil,can-grass-grow-on-clay-soil.html,Mistakes That Make Lawn Problems Worse,weeds-pests/mistakes-that-make-lawn-problems-worse.html,,
Warm Season vs Cool Season Grasses Explained,warm-season-vs-cool-season-grasses-explained.html,How Long Grass Can Go Without Water,how-long-grass-can-go-without-water.html,Why Grass Dies Along Driveways,why-grass-dies-along-driveways.html,Why Grass Becomes Stringy,why-grass-becomes-stringy.html,,
Best Grass Types for Hot Dry Climates,best-grass-types-for-hot-dry-climates.html,Why Grass Near Trees Struggles,why-grass-near-trees-struggles.html,Common Lawn Tool Safety Hazards,tools-safety/common-lawn-tool-safety-hazards.html,Can Grass Survive Extreme Heat,can-grass-survive-extreme-heat.html,,
Best Grass Types for Cold Winters,best-grass-types-for-cold-winters.html,Why Grass Dies Along Driveways,why-grass-dies-along-driveways.html,What Type of Grass Do I Have,what-type-of-grass-do-i-have.html,Mistakes That Kill New Grass,mistakes-that-kill-new-grass.html,,
How Grass Actually Grows,how-grass-actually-grows.html,How Short Is Too Short to Cut Grass,how-short-is-too-short-to-cut-grass.html,Can Grass Grow Through Rocks or Gravel,can-grass-grow-through-rocks-or-gravel.html,How Fast Grass Grows by Season,how-fast-grass-grows-by-season.html,,
How Long It Takes Grass to Germinate,how-long-it-takes-grass-to-germinate.html,How to Tell If Grass Is Underwatered,how-to-tell-if-grass-is-underwatered.html,How to Repair Bare Spots in a Lawn,how-to-repair-bare-spots-in-a-lawn.html,Can Grass Grow on Clay Soil,can-grass-grow-on-clay-soil.html,,
Why Grass Turns Yellow,why-grass-turns-yellow.html,Difference Between Manual and Powered Tools,tools-safety/difference-between-manual-and-powered-tools.html,Can Grass Recover After Drought,can-grass-recover-after-drought.html,,,,
Why Grass Turns Brown,why-grass-turns-brown.html,How Watering Affects Root Depth,watering-irrigation/how-watering-affects-root-depth.html,Why Grass Changes Texture Over Time,why-grass-changes-texture-over-time.html,How to Thicken a Thin Lawn,how-to-thicken-a-thin-lawn.html,,
Why Grass Grows Unevenly,why-grass-grows-unevenly.html,When Grass Is Beyond Saving,when-grass-is-beyond-saving.html,Why Grass Changes Texture Over Time,why-grass-changes-texture-over-time.html,,,,
How Often Grass Should Be Mowed,how-often-grass-should-be-mowed.html,How to Fix Flattened Grass,how-to-fix-flattened-grass.html,Why Grass Grows Faster in Some Areas,why-grass-grows-faster-in-some-areas.html,How Rainfall Patterns Affect Lawns,how-rainfall-patterns-affect-lawns.html,,
How Short Is Too Short to Cut Grass,how-short-is-too-short-to-cut-grass.html,How Slope Affects Grass Growth,how-slope-affects-grass-growth.html,How Long New Grass Takes to Establish,how-long-new-grass-takes-to-establish.html,How Often Grass Should Be Mowed,how-often-grass-should-be-mowed.html,,
What Happens If You Cut Grass Too Short,what-happens-if-you-cut-grass-too-short.html,Why Grass Looks Worse in Fall,why-grass-looks-worse-in-fall.html,How to Tell If Grass Is Dormant or Dead,how-to-tell-if-grass-is-dormant-or-dead.html,Does Grass Grow at Night,does-grass-grow-at-night.html,How Long Sod Takes to Root,how-long-sod-takes-to-root.html
How Tall Grass Should Be Left After Mowing,how-tall-grass-should-be-left-after-mowing.html,Why Grass Dies Along Driveways,why-grass-dies-along-driveways.html,What Type of Grass Do I Have,what-type-of-grass-do-i-have.html,Can Grass Adapt to Neglect,can-grass-adapt-to-neglect.html,,
How Fast Grass Grows by Season,how-fast-grass-grows-by-season.html,Warm Season vs Cool Season Grasses Explained,warm-season-vs-cool-season-grasses-explained.html,Why Lawns Look Different Yard to Yard,why-lawns-look-different-yard-to-yard.html,Can Grass Adapt to Neglect,can-grass-adapt-to-neglect.html,How Deep Grass Roots Really Go,how-deep-grass-roots-really-go.html
Does Grass Grow at Night,does-grass-grow-at-night.html,Why Lawns Decline Over Time,why-lawns-decline-over-time.html,Why Grass Dies Along Driveways,why-grass-dies-along-driveways.html,What Happens to Grass Roots When You Mow,what-happens-to-grass-roots-when-you-mow.html,,
Can Grass Recover After Being Scalped,can-grass-recover-after-being-scalped.html,Signs a Lawn Needs to Be Replaced,signs-a-lawn-needs-to-be-replaced.html,Why Grass Grows in Clumps,why-grass-grows-in-clumps.html,How Grass Responds to Stress,how-grass-responds-to-stress.html,,
How to Fix Patchy Grass,how-to-fix-patchy-grass.html,Can Grass Heal Itself,can-grass-heal-itself.html,How to Fix Flattened Grass,how-to-fix-flattened-grass.html,How Deep Grass Roots Really Go,how-deep-grass-roots-really-go.html,,
Why Grass Dies in Summer,why-grass-dies-in-summer.html,How Shade Affects Grass Growth,how-shade-affects-grass-growth.html,How Long a Lawn Typically Lasts,how-long-a-lawn-typically-lasts.html,Does Grass Grow at Night,does-grass-grow-at-night.html,How Long It Takes Grass to Germinate,how-long-it-takes-grass-to-germinate.html
Why Grass Dies in Winter,why-grass-dies-in-winter.html,Should You Bag or Mulch Grass Clippings,should-you-bag-or-mulch-grass-clippings.html,What Happens to Grass Roots When You Mow,what-happens-to-grass-roots-when-you-mow.html,How Tall Grass Should Be Left After Mowing,how-tall-grass-should-be-left-after-mowing.html,Why Lawns Decline Over Time,why-lawns-decline-over-time.html
How Grass Survives Drought,how-grass-survives-drought.html,How to Start Over With a Dead Lawn,how-to-start-over-with-a-dead-lawn.html,How to Thicken a Thin Lawn,how-to-thicken-a-thin-lawn.html,Best Grass for Shady Lawns,best-grass-for-shady-lawns.html,How Short Is Too Short to Cut Grass,how-short-is-too-short-to-cut-grass.html
How Grass Roots Grow,how-grass-roots-grow.html,How Weather Affects Grass Growth,how-weather-affects-grass-growth.html,How Shade Affects Grass Growth,how-shade-affects-grass-growth.html,How Often Grass Should Be Replaced,how-often-grass-should-be-replaced.html,,
How Deep Grass Roots Really Go,how-deep-grass-roots-really-go.html,What Makes Grass Turn Light Green,what-makes-grass-turn-light-green.html,Can You Mix Grass Types in One Lawn,can-you-mix-grass-types-in-one-lawn.html,How Grass Actually Grows,how-grass-actually-grows.html,,
How to Tell If Grass Is Dormant or Dead,how-to-tell-if-grass-is-dormant-or-dead.html,What Makes Grass Turn Dark Green,what-makes-grass-turn-dark-green.html,Can Grass Grow Through Rocks or Gravel,can-grass-grow-through-rocks-or-gravel.html,,,,
Best Time of Day to Water Grass,best-time-of-day-to-water-grass.html,How to Repair Bare Spots in a Lawn,how-to-repair-bare-spots-in-a-lawn.html,Can You Mix Grass Types in One Lawn,can-you-mix-grass-types-in-one-lawn.html,,,,
Best Time of Year to Overseed Grass,best-time-of-year-to-overseed-grass.html,Can Grass Grow in Compacted Soil,can-grass-grow-in-compacted-soil.html,Can Grass Grow on Sandy Soil,can-grass-grow-on-sandy-soil.html,Why Grass Grows Faster in Some Areas,why-grass-grows-faster-in-some-areas.html,Why Grass Near Fences Grows Differently,why-grass-near-fences-grows-differently.html
What Overseeding Actually Does,what-overseeding-actually-does.html,Best Grass Types for Hot Dry Climates,best-grass-types-for-hot-dry-climates.html,Why Diseased Grass Turns Brown,weeds-pests/why-diseased-grass-turns-brown.html,,,,
Can You Mix Grass Types in One Lawn,can-you-mix-grass-types-in-one-lawn.html,How Shade Affects Grass Growth,how-shade-affects-grass-growth.html,How Slope Affects Grass Growth,how-slope-affects-grass-growth.html,Warm Season vs Cool Season Grasses Explained,warm-season-vs-cool-season-grasses-explained.html,,
Pros and Cons of Mixed Grass Lawns,pros-and-cons-of-mixed-grass-lawns.html,When a Lawn Reaches the End of Its Life,when-a-lawn-reaches-the-end-of-its-life.html,Can Grass Survive Frost,can-grass-survive-frost.html,,,,
How to Thicken a Thin Lawn,how-to-thicken-a-thin-lawn.html,Why Grass Becomes Stringy,why-grass-becomes-stringy.html,Why Grass Changes Texture Over Time,why-grass-changes-texture-over-time.html,How Grass Survives Drought,how-grass-survives-drought.html,,
Why Grass Looks Good One Day and Bad the Next,why-grass-looks-good-one-day-and-bad-the-next.html,Why Grass Near Sidewalks Dies,why-grass-near-sidewalks-dies.html,How to Prepare Grass for Summer,how-to-prepare-grass-for-summer.html,Best Grass Types for Hot Dry Climates,best-grass-types-for-hot-dry-climates.html,Why Grass Thins Out Over the Years,why-grass-thins-out-over-the-years.html
How Long New Grass Takes to Establish,how-long-new-grass-takes-to-establish.html,Why Grass Smells After Cutting,why-grass-smells-after-cutting.html,Best Grass for Full Sun,best-grass-for-full-sun.html,,,,
Can You Walk on New Grass,can-you-walk-on-new-grass.html,How Short Is Too Short to Cut Grass,how-short-is-too-short-to-cut-grass.html,Can You Mix Grass Types in One Lawn,can-you-mix-grass-types-in-one-lawn.html,How Grass Actually Grows,how-grass-actually-grows.html,Difference Between Sod Seed and Plugs,difference-between-sod-seed-and-plugs.html
How to Repair Bare Spots in a Lawn,how-to-repair-bare-spots-in-a-lawn.html,Why Grass Becomes Stringy,why-grass-becomes-stringy.html,Why Grass Dies Along Driveways,why-grass-dies-along-driveways.html,,,,
Why Grass Grows Faster in Some Areas,why-grass-grows-faster-in-some-areas.html,Can You Mix Grass Types in One Lawn,can-you-mix-grass-types-in-one-lawn.html,Why Compacted Soil Encourages Issues,weeds-pests/why-compacted-soil-encourages-issues.html,Why Grass Near Sidewalks Dies,why-grass-near-sidewalks-dies.html,,
How Shade Affects Grass Growth,how-shade-affects-grass-growth.html,Why Grass Looks Burned but Isn’t,why-grass-looks-burned-but-isnt.html,Can Grass Survive Extreme Heat,can-grass-survive-extreme-heat.html,Why Lawns Look Different Yard to Yard,why-lawns-look-different-yard-to-yard.html,,
Best Grass for Shady Lawns,best-grass-for-shady-lawns.html,Mistakes That Increase Injury Risk,tools-safety/mistakes-that-increase-injury-risk.html,Can Grass Grow in Compacted Soil,can-grass-grow-in-compacted-soil.html,Why Grass Dies Along Driveways,why-grass-dies-along-driveways.html,,
Best Grass for Full Sun,best-grass-for-full-sun.html,How Long Sod Takes to Root,how-long-sod-takes-to-root.html,Can Grass Spread on Its Own,can-grass-spread-on-its-own.html,Best Grass Types for Cold Winters,best-grass-types-for-cold-winters.html,,
Why Grass Near Sidewalks Dies,why-grass-near-sidewalks-dies.html,Why Grass Looks Good One Day and Bad the Next,why-grass-looks-good-one-day-and-bad-the-next.html,Can Grass Survive Frost,can-grass-survive-frost.html,How Foot Traffic Damages Grass,how-foot-traffic-damages-grass.html,,
How Heat Reflecting Surfaces Affect Grass,how-heat-reflecting-surfaces-affect-grass.html,Common Lawn Care Myths That Kill Grass,common-lawn-care-myths-that-kill-grass.html,Why Grass Smells After Cutting,why-grass-smells-after-cutting.html,Why Grass Grows in Clumps,why-grass-grows-in-clumps.html,,
How Foot Traffic Damages Grass,how-foot-traffic-damages-grass.html,How Grass Reacts to Temperature Swings,how-grass-reacts-to-temperature-swings.html,What Happens to Grass Roots When You Mow,what-happens-to-grass-roots-when-you-mow.html,,,,
How to Make Grass More Durable,how-to-make-grass-more-durable.html,How Long Grass Can Go Without Water,how-long-grass-can-go-without-water.html,Mistakes That Shorten Tool Life,tools-safety/mistakes-that-shorten-tool-life.html,,,,
Why Grass Gets Matted Down,why-grass-gets-matted-down.html,How Long a Lawn Typically Lasts,how-long-a-lawn-typically-lasts.html,Why Lawns Look Different Yard to Yard,why-lawns-look-different-yard-to-yard.html,Can Grass Survive Extreme Heat,can-grass-survive-extreme-heat.html,,
How to Fix Flattened Grass,how-to-fix-flattened-grass.html,Common Lawn Care Myths That Kill Grass,common-lawn-care-myths-that-kill-grass.html,How Soil Health Affects Weed Growth,soil-fertilizer/how-soil-health-affects-weed-growth.html,How Shade Affects Grass Growth,how-shade-affects-grass-growth.html,,
How Often Grass Should Be Replaced,how-often-grass-should-be-replaced.html,What Overseeding Actually Does,what-overseeding-actually-does.html,Why Grass Becomes Stringy,why-grass-becomes-stringy.html,Can Grass Survive Extreme Heat,can-grass-survive-extreme-heat.html,,
Can Grass Spread on Its Own,can-grass-spread-on-its-own.html,Why Grass Grows Faster in Some Areas,why-grass-grows-faster-in-some-areas.html,How Heat Reflecting Surfaces Affect Grass,how-heat-reflecting-surfaces-affect-grass.html,,,,
Difference Between Sod Seed and Plugs,difference-between-sod-seed-and-plugs.html,When Repairs Make More Sense Than Replacement,tools-safety/when-repairs-make-more-sense-than-replacement.html,How to Tell If Grass Is Underwatered,how-to-tell-if-grass-is-underwatered.html,How to Tell If Grass Is Dormant or Dead,how-to-tell-if-grass-is-dormant-or-dead.html,Why Grass Near Trees Struggles,why-grass-near-trees-struggles.html
Is Sod or Seed Better for Small Lawns,is-sod-or-seed-better-for-small-lawns.html,How to Fix Flattened Grass,how-to-fix-flattened-grass.html,How Deep Grass Roots Really Go,how-deep-grass-roots-really-go.html,Why Grass Turns Brown,why-grass-turns-brown.html,,
How Long Sod Takes to Root,how-long-sod-takes-to-root.html,When Lawn Problems Stop on Their Own,weeds-pests/when-lawn-problems-stop-on-their-own.html,What Makes Grass Turn Dark Green,what-makes-grass-turn-dark-green.html,,,,
Mistakes That Kill New Grass,mistakes-that-kill-new-grass.html,Can You Walk on New Grass,can-you-walk-on-new-grass.html,Why Grass Changes Texture Over Time,why-grass-changes-texture-over-time.html,How Long Grass Can Go Without Water,how-long-grass-can-go-without-water.html,,
How to Tell If Grass Is Overwatered,how-to-tell-if-grass-is-overwatered.html,Why Grass Looks Good One Day and Bad the Next,why-grass-looks-good-one-day-and-bad-the-next.html,Best Time of Year to Overseed Grass,best-time-of-year-to-overseed-grass.html,,,,
How to Tell If Grass Is Underwatered,how-to-tell-if-grass-is-underwatered.html,Can You Mix Grass Types in One Lawn,can-you-mix-grass-types-in-one-lawn.html,Can Grass Grow Through Rocks or Gravel,can-grass-grow-through-rocks-or-gravel.html,How to Reduce Injury Risk While Working,tools-safety/how-to-reduce-injury-risk-while-working.html,,
Why Grass Smells After Cutting,why-grass-smells-after-cutting.html,Why Grass Looks Good One Day and Bad the Next,why-grass-looks-good-one-day-and-bad-the-next.html,Why Lawns Look Different Yard to Yard,why-lawns-look-different-yard-to-yard.html,How to Tell If Grass Is Overwatered,how-to-tell-if-grass-is-overwatered.html,,
Should You Bag or Mulch Grass Clippings,should-you-bag-or-mulch-grass-clippings.html,Difference Between Sod Seed and Plugs,difference-between-sod-seed-and-plugs.html,Can Grass Spread on Its Own,can-grass-spread-on-its-own.html,,,,
Do Grass Clippings Help or Hurt Lawns,do-grass-clippings-help-or-hurt-lawns.html,How Tall Grass Should Be Left After Mowing,how-tall-grass-should-be-left-after-mowing.html,Why Grass Turns Brown,why-grass-turns-brown.html,Why Grass Turns Yellow,why-grass-turns-yellow.html,,
How Weather Affects Grass Growth,how-weather-affects-grass-growth.html,How Foot Traffic Damages Grass,how-foot-traffic-damages-grass.html,How to Fix Flattened Grass,how-to-fix-flattened-grass.html,How to Start Over With a Dead Lawn,how-to-start-over-with-a-dead-lawn.html,Signs a Lawn Needs to Be Replaced,signs-a-lawn-needs-to-be-replaced.html
Why Grass Looks Different in Spring,why-grass-looks-different-in-spring.html,What Happens to Grass Roots When You Mow,what-happens-to-grass-roots-when-you-mow.html,Best Grass Types for Hot Dry Climates,best-grass-types-for-hot-dry-climates.html,Why Grass Becomes Stringy,why-grass-becomes-stringy.html,,
Why Grass Looks Worse in Fall,why-grass-looks-worse-in-fall.html,How Grass Competes With Itself,how-grass-competes-with-itself.html,How to Prepare Grass for Winter,how-to-prepare-grass-for-winter.html,How Weather Affects Grass Growth,how-weather-affects-grass-growth.html,Why Grass Spreads Sideways,why-grass-spreads-sideways.html
Can Grass Survive Frost,can-grass-survive-frost.html,Why Grass Looks Different in Spring,why-grass-looks-different-in-spring.html,How to Repair Bare Spots in a Lawn,how-to-repair-bare-spots-in-a-lawn.html,,,,
Can Grass Survive Extreme Heat,can-grass-survive-extreme-heat.html,How Wind Affects Grass Growth,how-wind-affects-grass-growth.html,How Grass Reacts to Temperature Swings,how-grass-reacts-to-temperature-swings.html,Why Fertilizer Doesn’t Fix Bad Soil,soil-fertilizer/why-fertilizer-doesnt-fix-bad-soil.html,,
How to Prepare Grass for Summer,how-to-prepare-grass-for-summer.html,How Slope Affects Grass Growth,how-slope-affects-grass-growth.html,Why Grass Grows in Clumps,why-grass-grows-in-clumps.html,When Grass Is Beyond Saving,when-grass-is-beyond-saving.html,,
How to Prepare Grass for Winter,how-to-prepare-grass-for-winter.html,How Often Grass Should Be Mowed,how-often-grass-should-be-mowed.html,How Long Grass Can Go Without Water,how-long-grass-can-go-without-water.html,Why Grass Turns Yellow,why-grass-turns-yellow.html,How Grass Roots Grow,how-grass-roots-grow.html
How Long Grass Can Go Without Water,how-long-grass-can-go-without-water.html,How to Tell If Grass Is Underwatered,how-to-tell-if-grass-is-underwatered.html,How to Make Grass More Durable,how-to-make-grass-more-durable.html,Why Grass Looks Worse in Fall,why-grass-looks-worse-in-fall.html,,
What Makes Grass Turn Dark Green,what-makes-grass-turn-dark-green.html,How Long It Takes Grass to Germinate,how-long-it-takes-grass-to-germinate.html,Can Grass Grow Through Rocks or Gravel,can-grass-grow-through-rocks-or-gravel.html,,,,
What Makes Grass Turn Light Green,what-makes-grass-turn-light-green.html,How Long a Lawn Typically Lasts,how-long-a-lawn-typically-lasts.html,How to Repair Bare Spots in a Lawn,how-to-repair-bare-spots-in-a-lawn.html,Can Grass Grow on Clay Soil,can-grass-grow-on-clay-soil.html,,
Can Grass Recover After Drought,can-grass-recover-after-drought.html,How Slope Affects Grass Growth,how-slope-affects-grass-growth.html,Best Time of Day to Water Grass,best-time-of-day-to-water-grass.html,Can Grass Grow Through Rocks or Gravel,can-grass-grow-through-rocks-or-gravel.html,,
Why Lawns Decline Over Time,why-lawns-decline-over-time.html,How Grass Actually Grows,how-grass-actually-grows.html,Can Grass Heal Itself,can-grass-heal-itself.html,How to Thicken a Thin Lawn,how-to-thicken-a-thin-lawn.html,,
How Long a Lawn Typically Lasts,how-long-a-lawn-typically-lasts.html,What Happens If You Cut Grass Too Short,what-happens-if-you-cut-grass-too-short.html,How Weather Affects Grass Growth,how-weather-affects-grass-growth.html,How Heat Reflecting Surfaces Affect Grass,how-heat-reflecting-surfaces-affect-grass.html,Why Grass Smells After Cutting,why-grass-smells-after-cutting.html
When Grass Is Beyond Saving,when-grass-is-beyond-saving.html,How to Prepare Grass for Winter,how-to-prepare-grass-for-winter.html,What Happens If You Never Mow Grass,what-happens-if-you-never-mow-grass.html,Can Grass Adapt to Neglect,can-grass-adapt-to-neglect.html,What Makes Grass Turn Light Green,what-makes-grass-turn-light-green.html
Signs a Lawn Needs to Be Replaced,signs-a-lawn-needs-to-be-replaced.html,Why Grass Looks Different in Spring,why-grass-looks-different-in-spring.html,How Long Sod Takes to Root,how-long-sod-takes-to-root.html,How Long Grass Can Go Without Water,how-long-grass-can-go-without-water.html,,
How to Start Over With a Dead Lawn,how-to-start-over-with-a-dead-lawn.html,How Foot Traffic Damages Grass,how-foot-traffic-damages-grass.html,How Grass Competes With Itself,how-grass-competes-with-itself.html,Best Time of Year to Overseed Grass,best-time-of-year-to-overseed-grass.html,,
Common Lawn Care Myths That Kill Grass,common-lawn-care-myths-that-kill-grass.html,Warm Season vs Cool Season Grasses Explained,warm-season-vs-cool-season-grasses-explained.html,How Long Grass Can Go Without Water,how-long-grass-can-go-without-water.html,Why Grass Thins Out Over the Years,why-grass-thins-out-over-the-years.html,Should You Bag or Mulch Grass Clippings,should-you-bag-or-mulch-grass-clippings.html
Why Grass Grows in Clumps,why-grass-grows-in-clumps.html,How Grass Responds to Stress,how-grass-responds-to-stress.html,When Grass Is Beyond Saving,when-grass-is-beyond-saving.html,What Overseeding Actually Does,what-overseeding-actually-does.html,,
How Wind Affects Grass Growth,how-wind-affects-grass-growth.html,How Long New Grass Takes to Establish,how-long-new-grass-takes-to-establish.html,Can Grass Heal Itself,can-grass-heal-itself.html,How Long It Takes Soil to Recover,soil-fertilizer/how-long-it-takes-soil-to-recover.html,,
Why Grass Near Fences Grows Differently,why-grass-near-fences-grows-differently.html,How Long Grass Can Go Without Water,how-long-grass-can-go-without-water.html,Why Grass Dies in Summer,why-grass-dies-in-summer.html,,,,
Can Grass Grow Through Rocks or Gravel,can-grass-grow-through-rocks-or-gravel.html,How Grass Responds to Stress,how-grass-responds-to-stress.html,Can Grass Spread on Its Own,can-grass-spread-on-its-own.html,Why Grass Dies Along Driveways,why-grass-dies-along-driveways.html,Why Grass Turns Brown,why-grass-turns-brown.html
Why Grass Dies Along Driveways,why-grass-dies-along-driveways.html,Is Sod or Seed Better for Small Lawns,is-sod-or-seed-better-for-small-lawns.html,Difference Between Sod Seed and Plugs,difference-between-sod-seed-and-plugs.html,,,,
How Long Grass Lives as a Plant,how-long-grass-lives-as-a-plant.html,What Makes Grass Turn Light Green,what-makes-grass-turn-light-green.html,Best Grass for Shady Lawns,best-grass-for-shady-lawns.html,How to Prepare Grass for Summer,how-to-prepare-grass-for-summer.html,How Often Grass Should Be Mowed,how-often-grass-should-be-mowed.html
What Happens to Grass Roots When You Mow,what-happens-to-grass-roots-when-you-mow.html,How Grass Responds to Stress,how-grass-responds-to-stress.html,How to Repair Bare Spots in a Lawn,how-to-repair-bare-spots-in-a-lawn.html,,,,
Why Grass Changes Texture Over Time,why-grass-changes-texture-over-time.html,How Grass Reacts to Temperature Swings,how-grass-reacts-to-temperature-swings.html,Why Fall Watering Is Often Missed,watering-irrigation/why-fall-watering-is-often-missed.html,Can Grass Grow on Clay Soil,can-grass-grow-on-clay-soil.html,,
How Grass Responds to Stress,how-grass-responds-to-stress.html,What Makes Grass Turn Dark Green,what-makes-grass-turn-dark-green.html,Why Grass Spreads Sideways,why-grass-spreads-sideways.html,,,,
Why Grass Thins Out Over the Years,why-grass-thins-out-over-the-years.html,How Wind Affects Grass Growth,how-wind-affects-grass-growth.html,Why Grass Smells After Cutting,why-grass-smells-after-cutting.html,Can Grass Heal Itself,can-grass-heal-itself.html,,
How Rainfall Patterns Affect Lawns,how-rainfall-patterns-affect-lawns.html,Mistakes That Kill New Grass,mistakes-that-kill-new-grass.html,How Long New Grass Takes to Establish,how-long-new-grass-takes-to-establish.html,How to Tell If Grass Is Overwatered,how-to-tell-if-grass-is-overwatered.html,,
Can Grass Grow in Compacted Soil,can-grass-grow-in-compacted-soil.html,How Foot Traffic Damages Grass,how-foot-traffic-damages-grass.html,How to Tell If Grass Is Underwatered,how-to-tell-if-grass-is-underwatered.html,Why Grass Turns Brown,why-grass-turns-brown.html,,
Why Grass Fails in New Construction Yards,why-grass-fails-in-new-construction-yards.html,Can Grass Spread on Its Own,can-grass-spread-on-its-own.html,How to Fix Flattened Grass,how-to-fix-flattened-grass.html,What Makes Grass Turn Dark Green,what-makes-grass-turn-dark-green.html,,
How Grass Reacts to Temperature Swings,how-grass-reacts-to-temperature-swings.html,How Often Grass Should Be Mowed,how-often-grass-should-be-mowed.html,What Overseeding Actually Does,what-overseeding-actually-does.html,,,,
Why Grass Looks Burned but Isn’t,why-grass-looks-burned-but-isnt.html,How Often Grass Should Be Mowed,how-often-grass-should-be-mowed.html,Can Grass Grow in Compacted Soil,can-grass-grow-in-compacted-soil.html,,,,
Can Grass Heal Itself,can-grass-heal-itself.html,What Makes Grass Turn Dark Green,what-makes-grass-turn-dark-green.html,How to Tell If Grass Is Underwatered,how-to-tell-if-grass-is-underwatered.html,Why Weeds Grow Near Sidewalks,weeds-pests/why-weeds-grow-near-sidewalks.html,,
Why Grass Spreads Sideways,why-grass-spreads-sideways.html,What Causes Brown Patches in Lawns,weeds-pests/what-causes-brown-patches-in-lawns.html,What Type of Grass Do I Have,what-type-of-grass-do-i-have.html,Do Grass Clippings Help or Hurt Lawns,do-grass-clippings-help-or-hurt-lawns.html,,
How Grass Competes With Itself,how-grass-competes-with-itself.html,How to Thicken a Thin Lawn,how-to-thicken-a-thin-lawn.html,Why Grass Dies in Summer,why-grass-dies-in-summer.html,Why Grass Dies Along Driveways,why-grass-dies-along-driveways.html,,
Why Lawns Look Different Yard to Yard,why-lawns-look-different-yard-to-yard.html,Why Grass Changes Texture Over Time,why-grass-changes-texture-over-time.html,How Tall Grass Should Be Left After Mowing,how-tall-grass-should-be-left-after-mowing.html,Why Grass Declines Even With Care,why-grass-declines-even-with-care.html,,
How Slope Affects Grass Growth,how-slope-affects-grass-growth.html,What Makes Grass Turn Dark Green,what-makes-grass-turn-dark-green.html,How Heat Reflecting Surfaces Affect Grass,how-heat-reflecting-surfaces-affect-grass.html,Why Grass Turns Yellow,why-grass-turns-yellow.html,,
