article_title,filename,link1_title,link1_filename,link2_title,link2_filename,link3_title,link3_filename,link4_title,link4_filename
Can Grass Grow on Clay Soil,can-grass-grow-on-clay-soil.html,Why Grass Looks Different in Spring,why-grass-looks-different-in-spring.html,How to Start Over With a Dead Lawn,how-to-start-over-with-a-dead-lawn.html,Why Grass Near Fences Grows Differently,why-grass-near-fences-grows-differently.html,,
Can Grass Grow on Sandy Soil,can-grass-grow-on-sandy-soil.html,Mistakes That Kill New Grass,mistakes-that-kill-new-grass.html,When a Lawn Reaches the End of Its Life,when-a-lawn-reaches-the-end-of-its-life.html,,,,
Why Grass Near Trees Struggles,why-grass-near-trees-struggles.html,Can Grass Survive Frost,can-grass-survive-frost.html,Is Sod or Seed Better for Small Lawns,is-sod-or-seed-better-for-small-lawns.html,,,,
How Long Grass Can Stay Dormant,how-long-grass-can-stay-dormant.html,Why Grass Near Trees Struggles,why-grass-near-trees-struggles.html,Why Grass Declines Even With Care,why-grass-declines-even-with-care.html,How Grass Roots Grow,how-grass-roots-grow.html,Why Grass Looks Worse in Fall,why-grass-looks-worse-in-fall.html
What Happens If You Never Mow Grass,what-happens-if-you-never-mow-grass.html,How Long Grass Lives as a Plant,how-long-grass-lives-as-a-plant.html,Can Grass Grow on Clay Soil,can-grass-grow-on-clay-soil.html,Best Grass Types for Hot Dry Climates,best-grass-types-for-hot-dry-climates.html,,
Why Grass Becomes Stringy,why-grass-becomes-stringy.html,How Long a Lawn Typically Lasts,how-long-a-lawn-typically-lasts.html,Why Grass Changes Texture Over Time,why-grass-changes-texture-over-time.html,How Wind Affects Grass Growth,how-wind-affects-grass-growth.html,,
Can Grass Adapt to Neglect,can-grass-adapt-to-neglect.html,How to Make Grass More Durable,how-to-make-grass-more-durable.html,Do Grass Clippings Help or Hurt Lawns,do-grass-clippings-help-or-hurt-lawns.html,How Foot Traffic Damages Grass,how-foot-traffic-damages-grass.html,,
Why Grass Declines Even With Care,why-grass-declines-even-with-care.html,Best Time of Day to Water Grass,best-time-of-day-to-water-grass.html,Why Grass Grows Unevenly,why-grass-grows-unevenly.html,,,,
When a Lawn Reaches the End of Its Life,when-a-lawn-reaches-the-end-of-its-life.html,What Makes Grass Turn Dark Green,what-makes-grass-turn-dark-green.html,Best Time of Year to Overseed Grass,best-time-of-year-to-overseed-grass.html,Why Lawns Decline Over Time,why-lawns-decline-over-time.html,Why Grass Looks Worse in Fall,why-grass-looks-worse-in-fall.html
